user_id,title,address_detail,lat,lng,content,proof_method,view_count,status,emd_cd
1,천안종합휴양관광지,충청남도 천안시 동남구 성남면 종합휴양지로 200,36.75731215,127.2240961,"중부권 최대의 온천관광지로 워터파크, 휴양콘도, 천안예술의 전당이 있음.",사진 인증,51,APPROVED,4413000000
1,태조산관광지,충청남도 천안시 동남구 태조산길 261,36.82207666,127.1889559,유량동 태조산 아래에 자리잡힌 넓은 공원으로 천안시민들의 문화ㆍ휴식 공간,사진 인증,158,APPROVED,4413000000
1,광덕계곡관광지,강원특별자치도 화천군 사내면 포화로 582,38.07630808,127.4817356,"광덕계곡은 백운산과 광덕산 사이에 위치하며 자연경관이 수려하고 오염되지 않은 작은폭포, 작은소 등 개끗한 물이 일품이다. 숙박시설이 마련되어 있어 여름 피서지로서 안성맞춤이다.",위치 인증,66,APPROVED,5179000000
1,용대관광지,강원특별자치도 인제군 북면 십이선녀탕길 16,38.18568475,128.3061965,"설악산국립공원의 내설악지역에 위치하고 있으며 십이선녀탕, 만해마을, 백담사, 황태덕장, 하천 등이 관광지 주변이 있음",위치 인증,218,APPROVED,5181000000
1,연희네슈퍼(영화 1987 촬영지),전라남도 목포시 해안로 127번길 14-2,34.78174519,126.3773176,영화 1987의 주인공 연희가 살던 곳이곳의 시간은 1987년이다. 개발되지 않은 배경에 1987년을 그대로 옮겨놓은 연희네 슈퍼는 단순한 영화세트장이 아니다. 각자의 1987년을 떠올릴 수 있는 공간이다. 문득 시간을 돌아보고 싶거든 연희네 슈퍼로 가자. 그곳에 나의 1987년이 있고 나의 연희가 있다.,위치 인증,332,APPROVED,4611000000
1,춤추는 바다분수,전라남도 목포시 평화로 82,34.79666213,126.4337909,"목포춤추는바다분수는 매년 4월부터 11월까지 8개월간 목포 평화광장 앞바다에서 음악과 분수, 워터스크린, 레이저, 빔프로 젝트를 이용한 미디어 아트 작품을 선보이고 있다. 목포춤추는바다분수는 수반길이 150m, 높이 13.5m, 최대분사 높이 70m의 세계최초 초대형 부유식 바다음악분수이다.이에 더해 2021년 10월부터는 바다분수 앞에 설치한 해상무대에서 불꽃과 바다분수가 어우러진 환상적인 해상공연을 펼칠 예정이다.",위치 인증,367,APPROVED,4611000000
1,목포해상케이블카,전라남도 목포시 해양대학로 240,34.79940179,126.3700239,"155m의 높이에서 스릴넘치는 아찔한 체험을...국내 최장구간 3.23km의 해상케이블카로 북항에서 고하도까지 이어진다.목포항과 삼학도를 비롯한 목포 원도심이 한눈에 펼쳐지고 보석처럼 빛나는 다도해와목포대교, 고하도 등을 조망할 수 있다.",사진 인증,414,APPROVED,4611000000
1,삼학도크루즈,전라남도 목포시 삼학로 92번길 104,34.78101571,126.387931,"삼학도 계류장을 출발하여 해상케이블카타워, 인어동상, 목포대교로 간다.잔잔한 목포 앞바다를 배를 타고 노니는것은 또 다른 경험이다. 오른쪽으로 높이오른 유달산과 목포대교의 일몰, 끝없이펼쳐진 다도해 그리고 고하도의 해안을감상할 수 있다.",사진 인증,171,APPROVED,4611000000
1,산정호수,경기도 포천시 영북면 산정호수로411번길 5 일원,38.065669,127.315722,백운산에서 흘러내린 맑은 물이 계곡을 이룬곳으로 경관이 수려함,QR 인증,227,APPROVED,4100000000
1,백운계곡,경기도 포천시 이동면 포화로 236-24 일원,38.072165,127.409889,"명성산 밑에 위치한 호수로 경관이 둘레길이 잘 조성되어 있고, 가을 억새로 장관을 이룸",사진 인증,29,APPROVED,4100000000
1,용문산 관광지,경기도 양평군 용문면 용문산로 641,37.54529617,127.583066,관광지를 품에 안고 있는 용문산의 웅장한 산세와 기암괴석이 만들어 낸 절경은 금강산을 방불케 한다.,QR 인증,100,APPROVED,4100000000
1,두물머리,경기도 양평군 양서면 두물머리길 145,37.53362262,127.3174715,물안개와 일출+ 황포돛배 그리고 400년이 넘은 느티나무가 어우러진 한국관광 100선에 선정된 곳,사진 인증,207,APPROVED,4100000000
1,세미원,경기도 양평군 양서면 양수로 93,37.54093866,127.3239608,경기도 제1호 지방정원,위치 인증,452,APPROVED,4100000000
1,쉬자파크,경기도 양평군 양평읍 쉬자파크길 193,37.51122354,127.5331978,쉼을 주는 공원으로 맑은공기+ 숙박+ 치유+ 체험과 교육이 함께하는 전국 최초 산림문화 휴양단지,사진 인증,492,APPROVED,4100000000
1,기독교선교100주년기념관,전라남도 광양시 진상면 성지로 399,35.04305027,127.6604508,"기독교역사관, 유품전시관",QR 인증,58,APPROVED,4623000000
1,섬진강 망덕포구,전라남도 광양시 진월면 망덕길 171,34.96787088,127.7579265,"550리 섬진강과 남해바다가 만나는곳, 윤동주시인 유고보존 정병욱 가옥",QR 인증,279,APPROVED,4623000000
1,춘장대,충청남도 서천군 서면 춘장대길 20,36.16334922,126.5243355,국내 유일의 해송림 해수욕장으로 캠핑장과 조개잡이 체험등 다양한 즐길거리와 인근 동백정 마량항등 볼거리도 풍부,사진 인증,132,APPROVED,4477000000
1,박경리기념관,경상남도 통영시 산양읍 산양중앙로 173,34.802301,128.4035792,통영이 낳은 대 소설가 박경리 선생님의 문학적 업적을 기리고 독창적이고 차별화된 문화콘텐츠를 육성하기 위해 기념관 건립함.,사진 인증,312,APPROVED,4822000000
1,해저터널,경상남도 통영시 당동 1-3,34.83609021,128.411698,동양 최초의 바다 밑 터널,QR 인증,107,APPROVED,4822000000
1,장사도해상공원,경상남도 통영시 한산면 장사도길 55,34.71373747,128.5588706,바다위의 공원으로 배를 타고 입장.,사진 인증,117,APPROVED,4822000000
1,통영시립박물관,경상남도 통영시 중앙로 65,34.84075153,128.4167887,"통영시립박물관은 통여의 소중한 문화자산을 잘 보존, 전시하여 후대에까지 전하려고 합니다.",위치 인증,487,APPROVED,4822000000
1,삼도수군통제영,경상남도 통영시 세병로 27,34.84715495,128.423489,"이충무공의 숨결이 살아있는 통제영은 삼도수군통제영의 약칭으로 삼도수군통제사가 경상,전라,충청 3도의 수군을 지휘하던 본영을 말한다. 최초의 통제영은 임진왜란 당시 초대 통제사로 제수된 이순신장군의 한산 진영이였다.",QR 인증,354,APPROVED,4822000000
1,운일암반일암,전북특별자치도 진안군 주천면 동상주천로 1924,35.97596963,127.408748,"기암괴석과 크고 작은 폭포, 소가 어울려 빚어낸 절경",위치 인증,292,APPROVED,5272000000
1,마이산도립공원 일원,전북특별자치도 진안군 마령면 마이산남로 182,35.75700898,127.3938329,"마이산은 암마이봉(686m)과 수마이봉(680m)으로 진안읍 단양리와 마령면 동촌리 경계면에 걸쳐있다. 신라시대 서다산(西多山), 고려시대 용출산(聳出山), 조선 초 속금산(束金山)에서 현재는 말의 귀를 닮았다는 의미의 마이산(馬耳山)으로 불리고 있다. 1979년 전라북도 도립공원으로 지정되었고 2003년 10월 31일에는 마이산 권역 160여 ㎢가 명승 제12호 국가지정문화재로 승격되어 진안군수가 위탁 관리한다.",QR 인증,478,APPROVED,5272000000
1,용담호및주변시설,전북특별자치도 진안군 안천면 안용로 793,35.94593497,127.5256742,"댐으로 만들어진 인공호수로써 높이 70m, 길이 498m, 저수량이 8억1,500톤에 이르고 댐주위로 난 이설도로를 따라 여러가지 볼거리가 구비되어 있다.",QR 인증,281,APPROVED,5272000000
1,운장산자연휴양림,전북특별자치도 진안군 정천면 휴향림길 77,35.89924607,127.4211096,약7㎞에 달하는 운장산 계곡은 원시림과 옥류수가 연중 흐르고 순환임도와 연접하고 여러가지 기암바위들이 자연수목과 조화를 이룬다,위치 인증,155,APPROVED,5272000000
1,데미샘자연휴양림,전북특별자치도 진안군 백운면 데미샘1길 172,35.6569938,127.4610402,데미샘은 3개도 10개 시군에 걸쳐 218.6㎞를 흐르는 우리나라에서 4번째로 긴강인 섬진강의 발원지이다,QR 인증,413,APPROVED,5272000000
1,진안고원치유의숲,전북특별자치도 진안군 정천면 봉학로 171-22,35.87516093,127.4177407,"전국 최초로 설립된 환경성질환 예방교육시설이다. 생활치료 공간으로 교육관과 생활관, 체험관, 유기농식당을 갖추고 있다. 방학과 주말은 물론 평일에도 아토피로 고통받는 어린이와 가족들이 함께행활하면저 치유할수 있다",위치 인증,122,APPROVED,5272000000
1,가위박물관,전북특별자치도 진안군 진안읍 마이산로 258,35.76592077,127.4150023,"세계유일의 가위박물관, 진안가위박물관, 마이산북부에 위치하고 세계 희귀 가위 1500여점을 소장",QR 인증,49,APPROVED,5272000000
1,은파관광지,전북특별자치도 군산시 은파순환길9 (나운동),35.95536227,126.6890748,봄철이 되면 화사한 벚꽃길로 유명하여 시민들의 사랑을 받고 있다.,위치 인증,494,APPROVED,5213000000
1,금강호관광지,전북특별자치도 군산시 성산면 철새로 120,36.01987856,126.7653058,국내 최대 철새도래지로서 자연과 문화가 어우러지는 사계절 관광지로 거듭나고 있음,위치 인증,166,APPROVED,5213000000
1,꽃보라동산,대구광역시 북구 산격동 1500-6,35.88935018,128.601059,대구광역시 북구 8경사진찍기좋은명소,사진 인증,454,APPROVED,2723000000
1,해달별천문대,전라남도 광양시 봉강면 하조길 91-20,35.07478024,127.5540516,"낮-태양, 밤-해·달 관찰, 천체사진 촬영",QR 인증,184,APPROVED,4623000000
1,백운산자연휴양림,전라남도 광양시 옥룡면 백계로 33,35.05164423,127.5985292,"교육장, 야영장, 수영장, 산책로",위치 인증,177,APPROVED,4623000000
1,광양 옥룡사지,전라남도 광양시 옥룡면 추산리 산 35-1,35.04701721,127.6085305,국가지정문화재 사적 제207호,사진 인증,406,APPROVED,4623000000
1,국사봉랜드,전라남도 광양시 옥곡면 대치로 433,35.00642478,127.6525399,"숙박, 물놀이장, 야외공연장",사진 인증,81,APPROVED,4623000000
1,산청중산관광지,경상남도 산청군 시천면 지리산대로 525,35.293297,127.7549317,수려한 자연경관과 지리산 천왕봉을 조망할 수 있는 산악형 관광지,사진 인증,132,APPROVED,4886000000
1,산청금서관광지,경상남도 산청군 금서면 친환경로 1715,35.394237,127.847052,수려한 자연경관을 조망할 수 있는 가족단위 형태의 관광지,사진 인증,197,APPROVED,4886000000
1,신지명사십리해수욕장,전라남도 완도군 신지면 명사십리길 85-105,34.327329,126.8088597,"모래 우는 소리가 십리 밖까지 들린다고 하여 울모래 또는 명사십리로 불리우며, 2019년 우리나라 최초로 블루플래그(친환경 안전해변)해변으로 지정되었다.",위치 인증,495,APPROVED,4689000000
1,해조류센터,전라남도 완도군 완도읍 해변공원로 84,34.320789,126.748793,2014년 3월에 개관한 완도국제해조류박람회 주제관으로 특산품 홍보관과 해조류 전시실로 구성되어 있다.,위치 인증,462,APPROVED,4689000000
1,예당관광지,충청남도 예산군 응봉면 예당관광로 161,36.63801252,126.799434,"예당호를 배경으로 예당호 출렁다리, 예당호 조각공원, 느린호수길, 캠핑장, 야영장이 조성되어 있어 가족단위 휴양객이 즐길수 있는 관광지",QR 인증,264,APPROVED,4481000000
1,덕산온천관광단지,충청남도 예산군 덕산면 온천단지2로 11,36.69075649,126.659328,"1917년 처음으로 탕을 이용한 온천으로 개장됐으며, 49도씨 이상의 천연중탄산나트륨 온천수로 전국 최고의 온천수로 인정받고 있다.",QR 인증,106,APPROVED,4481000000
1,보수동책방골목,부산광역시 중구 대청로 57-1,35.10323904,129.0263248,"보수동 책방골목은 국제시장 입구 대청로 사거리 건너 보수동쪽으로 난 사선 방향의 좁은 골목길에 집결된 책방을 말한다. 8.15광복 직후 오늘날의 국제시장이 태평양전쟁으로 주택가가 철거되어 빈터로 놓여 있을 때 일본인이 남기고 간 책을 난전을 벌여 팔았는데, 그 장소가 개인소유가 되자, 보수동 앞길로 책장사들이 한 두 사람 자리를 옮겨 앉게 되면서부터 오늘의 골목이 형성되는 바탕이 되었다.",QR 인증,294,APPROVED,2611000000
1,용두산공원,부산광역시 중구 용두산길 37-55,35.1009305,129.0324434,"부산의 역사가 살아 숨쉬고 있는 대표적 관광명소로서 부산의 상진인 120m 높이의 부산타워, 부산 시민의 종, 충무공 이순신 동상, 미술전시관 등이 조화롭게 조성되어 있다.",사진 인증,114,APPROVED,2611000000
1,광복로,부산광역시 중구 광복중앙로 1,35.09947039,129.0311659,"패션·쇼핑거리로 중앙에는 21세기 도약의 이미지를 상징하는 `비상 2000` 조형물이 설치되어 있다. 매년 광복로 문화축제를 개최하는 볼거리, 즐길거리가 풍성한 문화예술의 거리이다.",위치 인증,136,APPROVED,2611000000
1,부산영화체험박물관,부산광역시 중구 대청로126번길 12,35.10169342,129.033594,"부산영화체험박물관은 대한민국을 대표하는 영화체험 복합문화공간입니다. 전국 최초의 영화관련 전문전시체험시설로 지상지상 4층, 지하 3층으로 구성된 본 체험박물관은 영화의 원리를 이해하고 제작의 즐거움을 체험할 수 있는 다양한 전시시설 및 영화의 과거와 미래를 연결하는 하이테크 시네마를 갖추고 있습니다.",위치 인증,15,APPROVED,2611000000
1,운암지수변공원,대구광역시 북구 구암동 349,35.93241418,128.5674979,대구광역시 북구 8경사진찍기좋은명소,위치 인증,392,APPROVED,2723000000
1,팔달대교 야경,대구광역시 북구 팔달동 524-4,35.89629048,128.5491628,대구광역시 북구 8경사진찍기좋은명소,위치 인증,319,APPROVED,2723000000
1,금호강하중도,대구광역시 북구 노곡동 673,35.90019471,128.5595886,대구광역시 북구 8경사진찍기좋은명소,위치 인증,495,APPROVED,2723000000
1,경북대학교 캠퍼스,대구광역시 북구 대학로80,35.88909849,128.6143217,대구광역시 북구 8경사진찍기좋은명소,QR 인증,27,APPROVED,2723000000
1,함지공원,대구광역시 북구 동암로38길 9,35.9424608,128.570482,대구광역시 북구 8경사진찍기좋은명소,위치 인증,254,APPROVED,2723000000
1,구암서원,대구광역시 북구 연암공원로17길 20,35.89881592,128.5989989,대구광역시 북구 8경사진찍기좋은명소,위치 인증,56,APPROVED,2723000000
1,침산정,대구광역시 북구 침산남로9길 118,35.897221,128.5848591,대구광역시 북구 8경사진찍기좋은명소,QR 인증,400,APPROVED,2723000000
1,달성토성마을,대구광역시 서구 국채보상로 83길 21 (비산동) 일대,35.87331563,128.5753765,집안에 있는 화분을 골목으로 꺼내놓으며 시작된 골목정원,위치 인증,431,APPROVED,2717000000
1,신라불교초전지,경상북도 구미시 도개면 도개다곡길 389-46,36.29090918,128.3633378,"고구려 승려 아도화상이 산라에 불교를 처음 전한 곳으로, 전통한옥숙박체험, 사찰음식체험(유료) / 신라불교초전기념관, 전시가옥(무료) 등 신라문화를 재현하여 체험할 수 있음",위치 인증,477,APPROVED,4719000000
1,마니산 국민관광지,인천광역시 강화군 화도면 마니산로675번길 18,37.63245827,126.4237957,백두산과 한라산의 중간지점에 위치하여 우리나라에서 기가 가장 센 곳이며 정상에 있는 참성단에서 매해 제례를 올리고 칠선녀가 전국 체육대회의 성화를 채화함,사진 인증,480,APPROVED,2871000000
1,롯데월드 부산,부산광역시 기장군 기장읍 동부산관광로 42,35.19603043,129.2129711,"부산광역시 기장군 기장읍 시랑리 산46에 위치한 테마파크. 줄여서 부롯이라 부른다. 오시리아관광단지 테마파크존 내에 조성된 핵심시설로, 서울에 있는 롯데월드 어드벤처와 부산 롯데월드 스카이프라자, 롯데월드 언더씨킹덤에 이은 롯데월드의 4번째 테마파크이다.",사진 인증,1,APPROVED,2671000000
1,좌구산휴양랜드,충청북도 증평군 증평읍 솟점말길 107,36.70556821,127.6511216,"증평의 명산 좌구산에 조성된 휴양랜드로서, 휴양림, 캠핑, 명상구름다리, 명상의 집, 줄타기체험, 사계절썰매장 등 다양한 체험시설과 아름다운 풍경을 한눈에 담을 수 있음",위치 인증,443,APPROVED,4374500000
1,좌구산 천문대,충청북도 증평군 증평읍 솟점말길 187,36.70370345,127.6530963,356mm 굴절망원경을 갖추어 천체의 생생한 모습과 좌구산의 맑고 깨끗한 밤하늘을 관찰할 수 있음,위치 인증,267,APPROVED,4374500000
1,증평민속체험박물관,충청북도 증평군 증평읍 둔덕길 89,36.7638886,127.5955694,"증평의 역사와 전통문화를 만날 수 있는 문화공간으로 증평의 문화재, 옛 사진, 출토유물, 고서, 민속품 등 다양한 문화유산을 관람할 수 있으며, 농경문화체험과 전시연계교육 등 종합적인 교육체험을 할 수 있음",위치 인증,202,APPROVED,4374500000
1,보강천 미루나무숲,충청북도 증평군 증평읍 송산리 649-45,36.78834006,127.5810146,"보강천 수변에 위치하고 형형색색 이국풍의 꽃과 풍차, 분수, 놀이터 등 다양한 휴식공간을 갖추며, 산책뿐만 아니라 사진을 찍으며 추억을 쌓기 좋은 곳, 증평인삼골 축제 개최",사진 인증,9,APPROVED,4374500000
1,증평인삼문화센터,충청북도 증평군 증평읍 중부로 2451,36.79588146,127.5817602,지역 농특산물인 인삼을 판매하는 대표 인삼판매장,사진 인증,314,APPROVED,4374500000
1,에듀팜특구관광단지(벨포레리조트),충청북도 증평군 도안면 벨포레길 346,36.84514868,127.5821182,충청북도 유일한 관광특구단지+중부권 최대관광단지로 다양한 액티비티 활동과 휴양시설을 갖춤,위치 인증,344,APPROVED,4374500000
1,농월정,경상남도 함양군 안의면 농월정길 9-35,35.62464301,127.7815571,"안의 삼동 중에서 화려한 자연의 미를 간직한 곳이 화림동이다. 화림동은 안의에서 전북 장수군으로 통하는 국도 26호선을 따라 약 4km를 가면 굽이치는 물가에 아담한 마을하나를 발견할 수 있는데, 이 곳이 화림동의 정수 농월정이 있는 곳이다. 화림동은 남덕유산에서 발원하는 금천이 굽이치며 흘러 팔담팔정을 이루었다. 그래서, 옛부터 화림동을 정자문화의 보고라 한다. 지금도 농월정을 비롯한 4개의 고풍스런 정자가 남아 있다. 특히 농월정은 달을 희롱하며 논다는 옛날 우리 선조들의 풍류사상이 깃든 곳, 함양을 찾은 많은 시인과 묵객들이 필히 거쳐간 곳이다. 이 곳 녹수를 사이에 둔 양쪽 산기슭의 송림은 거문고 현을 퉁기는 듯하며, 길게 늘어선 수양버들은 천줄기의 실로 낚시질을 하는 듯 보인다. 맑은 물이 급한 굴곡을 이루는 곳에 커다란 반석이 펼쳐져 있다. 반석위를 흐르는 물이 달빛을 받아 금물결을 이루는 이 곳에 세워진 고색창연한 농월정은 이름 그대로 달을 희롱하고 있는 듯하다. 크기를 짐작할 수 없을 정도로 거대한 월연암이라 이름 붙은 너럭바위 위로 미끄럼타듯 물살이 세차게 흐르고, 물길따라 골이 깊게 패였다. 월연의 맑은 물에서 물장구치며 노는 개구쟁이들의 모습과 아름다운 풍경은 한 폭의 동양화가 되어 지나는 행인의 발걸음을 멈추게 한다.",위치 인증,339,APPROVED,4887000000
1,구 동본원사 목포별원,전라남도 목포시 영산로 75번길 5,34.78970032,126.3842863,동본원사는 목포에 들어선 일본 첫 불교사원으로 정식명칭은 ‘진종 대곡파 동본원사’이다. 동본원사 목포별원은 1898년 4월에 세워졌으며 목포심상고등학교 설립 인가를 받아 목포 내에서 일본인 소학교로 최초·정식 운영되기도 했다. 해방 이후 정광사의 관리를 받다가 1957년부터 목포중앙교회로 사용하게 되어 사찰이 교회가 되는 이색적인 약력을 가지게 되었다. 현재는 각종 문화행사 및 전시회 공간으로 활용되고 있다.,위치 인증,319,APPROVED,4611000000
1,유달산,전라남도 목포시 유달로 180,34.79142993,126.3759183,노령산맥의 맨 마지막 봉우리이자 다도해로 이어지는서남단의 땅 끝인 산 해발 228미터 기암괴석으로 이루어진 유달산은 노령산맥의 맨 마지막 봉우리이다. 정상에 올라 서면 목포 시내가 한눈에 내려다보이며 푸른 다도해의 경관이 시원스레 펼쳐져 있고 그 사이를 오고가는 크고 작은 선박들의 모습이 한폭의 동양화를 연상시킨다.,위치 인증,126,APPROVED,4611000000
1,서산동 시화골목,전라남도 목포시 해안로 127번길 14-2,34.78174519,126.3773176,지역의 시인과 화가 그리고 주민들이 참여하여 생활적인 시와 벽화를 구성해 놓은 곳이다.개발되지 않은 1970 ~ 80 년대 해안가 마을의 골목길을 보존해 당시의 생활적 정서를 엿볼 수 있는 대표적인 레트로 공간이다. 초입에 1987의 촬영지 연희네 슈퍼가 있어 조화를 이루고 있다,사진 인증,90,APPROVED,4611000000
1,대둔산도립공원,전라북도 완주군 운주면 대둔산공원길 23,36.11708032,127.3328815,사계절이 모두 아름다운 완주의 자랑이자 보물인 산,위치 인증,436,APPROVED,5200000000
1,방화동가족휴가촌,전북특별자치도 장수군 번암면 방화동로 778,35.59064179,127.5268761,전국 8대종산에 속하는 장안산 기슭을 따라 펼쳐지는 맑고 깨끗한 계곡을 끼고 조성된 국민 휴양지,사진 인증,404,APPROVED,5274000000
1,고래불관광지,경상북도 영덕군 병곡면 고래불로 68,36.57151713,129.4190153,명사20리 라고 불리는 8km에 이르는 넓고 긴 양질의 백사장과 빼어난 해송림 등 우수한 자연자원을 보유한 관광지,사진 인증,213,APPROVED,4777000000
1,장사해수욕장관광지,경상북도 영덕군 남정면 동해대로 3592,36.2824187,129.3755938,해수욕장의 청정 자연자원과 장사상륙작전이라는 역사적 사건을 보존한 관광지,QR 인증,225,APPROVED,4777000000
1,양천향교,서울특별시 강서구 양천로47나길 53,37.572863,126.839905,조선 태종 11년(1411년)에 만들어졌으며 현재 서울에 남아있는 유일한 향교이다. 이름 때문에 양천구에 위치한 것으로 오해할 수 있으나 실제로는 강서구 가양동에 위치하고 있다. 인근에 위치한 서울 지하철 9호선 양천향교역 역시 이 곳의 이름을 따서 제정되었다.,사진 인증,232,APPROVED,1150000000
1,약사사,서울특별시 강서구 금낭화로17길 261,37.58312625,126.8050072,서울 강서구 관내 전통사찰 중 제1의 위상을 지닌 대한불교조계종 직할교구 사찰,QR 인증,99,APPROVED,1150000000
1,서울양천고성지,서울특별시 강서구 양천로47나길 52-54,37.57425363,126.8413319,양천고성지는 양천향교의 뒷산인 궁산에 있는 옛 성터. 백제 22대 문주왕이 웅진으로 천도(475년)하기 전 강 건너 고구려 침입에 대비하기 위해 쌓은 성으로 조선 성종(1470년)까지 요새가 있었던 것으로 짐작된다.,QR 인증,399,APPROVED,1150000000
1,허가바위,서울특별시 강서구 허준로5길 15,37.56983571,126.8500301,옛날 석기 시대의 사람들이 이곳에서 살았으리라 짐작되는 혈거동굴로서 연구 가치가 매우 높다. 허준은 허가바위에서 『동의보감』을 완성했다고 한다.,사진 인증,259,APPROVED,1150000000
1,허준근린공원,서울특별시 강서구 허준로5길 42,37.56759867,126.8537291,공원주위에는 서울 기념물 제11호인 허가바위가 있고 공원내에는 전설이 깃든 광주바위와 허준 선생이 앉아서 병자를 진료하는 인자한 모습의 동상 그리고 호수 정자 어린이 놀이 시설이 있으며 인근 주민들의 휴식공간으로 이용되고 있다.,QR 인증,299,APPROVED,1150000000
1,궁산땅굴역사전시관,서울특별시 강서구 양천로49길 106,37.57266746,126.8383649,"궁산 땅굴은 태평양전쟁 말기 일제 강점기에 굴착된 곳으로, 무기나 탄약 등, 군수물 자를 저장하거나 김포 비행장을 감시하고, 공습 때에는 부대 본부로 사용하기 위한 곳이었다고 전해진다.",위치 인증,98,APPROVED,1150000000
1,안성남사당공연장,경기도 안성시 보개면 남사당로 198-2,37.03181804,127.310053,안성맞춤랜드 내 위치한 안성남사당 상설공연용 공연장,위치 인증,79,APPROVED,4100000000
