user_id,title,address_detail,lat,lng,content,proof_method,view_count,status,emd_cd
1,다산초당,전라남도 강진군 도암면 다산초당길 68-35,34.5807211,126.7449445,다산초당은 조선 후기 실학 사상을집대성한 다산 정약용 선생이 18년간의 유배기간 중 10여년간 생활하며후학을 양성하고 ’’’’목민심서’’’’를 비롯하여 500여권의 책을 저술했던 조선실학의 산실이다.,사진 인증,2,APPROVED,4681000000
1,고려청자박물관,전라남도 강진군 대구면 청자촌길 33,34.50866203,126.8008374,"고려청자의 체계적인 관리와 연구를 위해1997년 고려청자박물관을 개관,운영하여청자의 연구는 물론 누구나 쉽게 청자를접하고 이해할 수 있도록 하고 있다.",사진 인증,421,APPROVED,4681000000
1,백련사,전라남도 강진군 도암면 백련사길 145,34.58775658,126.747892,신라말에 창건되어 1211년 원묘국사요세에 의해 중창된 백련사는 1236년백련결사문을 발표하고 백련결사운동을주창하였으며 고려 8국사와 조선 8대사를배출하여 명찰로 알려지게 되었다,사진 인증,157,APPROVED,4681000000
1,진주성,경상남도 진주시 남강로 626(본성동),35.19043229,128.0802214,8년 연속 한국관광100선에 선정된 진주의 대표적인 관광지이자 사적지이다. 진주목사 김시민 장군이 임진왜란 때 3800여명의 적은 군사로 2만여 명의 왜군을 물리친 임진왜란 3대첩지의 하나로 다양한 유물과 유적이 성내에 있다.,QR 인증,37,APPROVED,4817000000
1,진양호,경상남도 진주시 남강로1번길 130(판문동),35.17660992,128.0362677,지리산을 바라볼 수 있는 아름다운 자연 경관과 어우러진 진양호는 시원하게 탁 트인 전망 속 호반의 물안개와 황홀한 저녁노을로 많은 사랑을 받고 있다.  진양호공원ㆍ 휴게전망대ㆍ소원계단ㆍ동물원ㆍ진주전통소싸움경기장ㆍ남강댐물문화관ㆍ어린이 교통공원ㆍ진양호 일주도로 등의 다양한 볼거리가 있다.,QR 인증,20,APPROVED,4817000000
1,경상남도 수목원,경상남도 진주시 이반성면 수목원로 386,35.15719862,128.2957346,경상남도 수목원은 산림과 동식물에 대한 자연생태 종합학습교육장이다. 3340여 종의 식물을 보유하고 있으며 테마별로 전시관과 식물원이 조성되어 있어 나들이장소와 데이트 코스로 사랑받고 있다.,위치 인증,316,APPROVED,4817000000
1,월아산 숲속의 진주,경상남도 진주시 진성면 달음산로 313,35.199915,128.1941257,월아산을 중심으로 조성된 복합 산림복지시설로 우드랜드ㆍ 산림레포츠ㆍ 자연휴양림 등 도심지와 가까운 곳에서 다양한 산림휴양을 즐길 수 있는 명소로 사랑받고 있다.,QR 인증,346,APPROVED,4817000000
1,진주 K-기업가정신센터,경상남도 진주시 지수면 지수로 482,35.23484495,128.2705103,2018년 한국경영학회가 진주시를 대한민국 기업가정신 수도로 선포한 것을 계기로 LGㆍGSㆍ삼성 등 글로벌 기업 창업주들이 다녔던 옛지수초등학교를 기업가정신 교육센터와 전문도서관 및 체험센터로 리모델링하여 기업가정신을 널리 확산하기 위해 설립하여 운영하고 있다.,사진 인증,291,APPROVED,4817000000
1,물빛나루쉼터(김시민호),경상남도 진주시 망경로 195,35.18657405,128.0788814,물빛나루쉼터는 전통 목구조 건축 방식의  현대적 재현을 목표한 건축물로 2022 대한민국 목조건축대전ㆍ2023 캐나다 우드 디자인 앤 빌딩 어워드등에서 수상을 하였다. 김시민호는 남강의 운행하는 유람선으로 특히 야간에 선상에서 바로보는 진주성과 음악분수대의 화려한 조명 분수는 김시민호만의 매력 포인트이다.,QR 인증,248,APPROVED,4817000000
1,일호광장진주역,경상남도 진주시 진주대로879번길 18(강남동),35.17816441,128.0893466,일호광장 진주역은 2024년 대한민국 공간문화대상에서 대통령상을 수상한 철도문화공원 내 위치하고 있다. 상설 및 기획 전시를 통해 철도와 관련된 기록을 공유함으로써 과거의 흔적과 옛 감성을 느낄 수 있다.,위치 인증,97,APPROVED,4817000000
1,방동관광지,강원특별자치도 인제군 기린면 방동약수로 89-59,37.94387136,128.3962628,기린면 방동지역에 위치하고 있음,위치 인증,86,APPROVED,5181000000
1,진주목공예전수관,경상남도 진주시 명석면 광제산로 367,35.24702277,128.0417914,경남무형유산을 비롯하여 소목장의 고장으로 명석면에 위치하고 있으며 역사와 전통이 있는 진주소목의 가치를 알리고자 자체개발한 일일체험과 다양하고 전문적인 주ㆍ야간 목공 교육프로그램 및 전시실 운영으로 진주의 우수한 목공예 문화를 발전 계승한다.,위치 인증,352,APPROVED,4817000000
1,진주시립이성자미술관,경상남도 진주시 에나로 128번길 14(충무공동),35.17580996,128.1427403,"진주시립이성자미술관은 진주 출신 이성자 작가의 376점의 작품을 기증받아 2015년 7월 16일에 개관하였다. 동녘의 여대사라고 불릴 만큼 세계적인 작가였던 이성자는 여성으로서 한국 최초의 프랑스 유학을 떠났으며 동양철학으로 서양의 문화를 재해석하여 자신만의 독창적인 작업세계를 펼쳤다. 진주시는 이성자 작가의 예술적 업적과 삶을 기리기 위해 작품에 대한 연구ㆍ수집ㆍ보존ㆍ전시ㆍ교육을 운영하고 있으며 현재 진주혁신도시 영천 강변에 위치한 미술관은 “나의 미술관이 지어진다면, 강을 조망할 수 있는 곳이면 좋겠다”라는 작가의 바램을 담은 공간이다.",QR 인증,276,APPROVED,4817000000
1,진주익룡발자국전시관,경상남도 진주시 영천강로68번길 22(충무공동),35.1686382,128.1396863,천연기념물 진주 충무공동 익룡 새 공룡발자국 화석산지에 건립된 박물관으로 1억여년전 살았던 익룡을 비롯한 많은 생명체들의 흔적들이 화석으로 남아있다. 화석산지 현장이 그대로 보존된 보호각과 경남진주혁신도시 조성공사 중 발굴된 화석이 전시되어 있으며 화석과 관련된 다양한 체험이 마련되어 있어 가족 모두가 보고 즐길 수 있다.,사진 인증,461,APPROVED,4817000000
1,진주청동기문화박물관,경상남도 진주시 대평면 호반로 1353,35.22437983,127.9619637,남강댐 확장에 따라 수몰된 국내 청동기시대 최대 유적지인 대평마을에 만들어진 청동기시대 전문박물관으로 상설전시관과 기획전시관ㆍ입체영상관과 야외전시장ㆍ수변산책로 및 물놀이 시설 등을 갖추고 있다.,QR 인증,260,APPROVED,4817000000
1,진주남강유등전시관,경상남도 진주시 망경로 207,35.18180059,128.0772058,진주를 대표·상징하는 유등을 주제로 한 다양한 전시와 프로그램을 운영하고 야외 옥외정원에 유등을 상시 전시하여 관람객들이 예술과 소통할 수 있는 공간으로 자리잡고 있다.,위치 인증,431,APPROVED,4817000000
1,벽계관광지,경상남도 의령군 궁류면 벽계로 201,35.42604967,128.2080942,"주변경관이 수려하며 물놀이장, 공연장, 캠프파이어장을 갖추고 있음",위치 인증,195,APPROVED,4872000000
1,우수영관광지,전라남도 해남군 문내면 관광레저로 1,34.57257374,126.3101147,이순신장군의 명량대첩의 감동이 살아있는 관광지,QR 인증,163,APPROVED,4682000000
1,땅끝관광지,전라남도 해남군 송지면 땅끝마을길 100,34.29471348,126.5250233,한반도의 최남단이자 삼천리 금수강산의 시작점으로 희망을 상징하는 관광지,위치 인증,50,APPROVED,4682000000
1,오색관광지,강원특별자치도 양양군 서면 가라피리 165,38.077061,128.5128997,설악산과 오색령에 아름다운 자연경관을 볼수 있음,사진 인증,139,APPROVED,5183000000
1,지경관광지,강원특별자치도 양양군 현남면 지리 5-1,37.927413,128.794861,동해안 해안절경 감상,사진 인증,408,APPROVED,5183000000
1,설해원(양양국제공항),강원특별자치도 양양군 손양면 동호리 510-28,38.055556,128.664198,장기체류형 종합 스포츠레저단지,사진 인증,300,APPROVED,5183000000
1,오수의견관광지,전북특별자치도 임실군 오수면 충효로 2096-16,35.54520338,127.3326779,재정비 공사중(24.12월까지),사진 인증,25,APPROVED,5275000000
1,사선대관광지,전북특별자치도 임실군 관촌면 사선2길 68-7,35.672357,127.2746265,경관이 수려하고 편의시설이 있음,사진 인증,55,APPROVED,5275000000
1,해운대해수욕장,부산광역시 해운대구 해운대해변로 264,35.15910698,129.1602838,6월부터 9월까지 해수욕장을 개장하여 해수욕을 즐길 수 있다. 수심이 얕고 조수의 변화가 심하지 않아 해마다 천만 명이 넘는 피서색이 찾는다. 또한 매년 해수욕장 개장에 맞춰 다양한 행사와 축제가 개최된다,QR 인증,244,APPROVED,2635000000
1,달맞이동산지구,부산광역시 해운대구 달맞이길 190,35.15768146,129.1825429,"벚나무와 송림이 울창하게 들어찬 오솔길로 드라이브 코스로 유명하다. 달맞이 고개 일대에서는 다양한 예술작품을 만날 수 있고, 특히 보름날 달빛에 어우러진 바다 정취는 데이트 코스로 유명하다.",QR 인증,185,APPROVED,2635000000
1,변산해수욕장,전북특별자치도 부안군 변산면 변산로 2086,35.67999179,126.5309105,국립공원 변산반도에 위치한 노을이 아름다운 해수욕장,위치 인증,101,APPROVED,5280000000
1,위도해수욕장,전북특별자치도 부안군 위도면 위도로 366,35.60583098,126.2853294,산들이 감싸고 있는 아담한 모래사장과 맑은 물이 아름다운 위도의 해수욕장,사진 인증,40,APPROVED,5280000000
1,모항해수욕장,전북특별자치도 부안군 변산면 모항길 23-1,35.5831428,126.5082098,아담한 백사장과 소나무 밭이 조화를 이루는 해수욕장,위치 인증,282,APPROVED,5280000000
1,합천호회양관광단지,경상남도 합천군 대병면 회양리 700-27,35.524398,128.016537,자연 경관이 뛰어난 호반 유원지,위치 인증,251,APPROVED,4889000000
1,심우장,서울특별시 성북구 성북로29길 24,37.5936268,126.9916662,만해 한용운의 일제강점기 머물던 집,사진 인증,375,APPROVED,1129000000
1,길상사,서울특별시 성북구 선잠로5길 68(성북동),37.59910942,126.9946522,최고급 요정에서 도심속 도량으로 환골탈퇴,QR 인증,333,APPROVED,1129000000
1,한국가구박물관,서울특별시 성북구 대사관로121,37.60037831,126.9934492,한국의 전통가구를 한눈에 볼수있는 곳,QR 인증,229,APPROVED,1129000000
1,서울 한양도성(서울성곽),서울특별시 용산구 후암동 산1-2,37.551483,126.9853756,"조선왕조 도읍지인 한성부의 경계를 표시하고 그 권위를 드러내며, 외부의 침입을 막기 위해 축조된 성이다.",사진 인증,416,APPROVED,1117000000
1,후암동 조선은행 사택지,서울특별시 용산구 후암로16가길 7,37.547716,126.9786783,일제강점기인 1920년대 서울의 도시화와 함께 후암동 일대가 본격적으로 개발되는 가운데 생긴 대표적인 문화주택지였다.,위치 인증,105,APPROVED,1117000000
1,주남저수지,경상남도 창원시 의창구 동읍 주남로 101번길 26,35.30732964,128.6779306,"해마다 찾아오는 수만 마리의 철새들과 텃새들의 서식지로 다양한 수생식물, 수서곤충 등을 만나볼 수 있으며 철새들의 자유로운 곡예비행을 생생하게 관찰할 수 있는 곳이다. 천연기념물 16여종과 환경부 멸종위기 10여종 등 다양한 철새들을 직접 볼 수 있다.",사진 인증,101,APPROVED,4812100000
1,마금산온천,경상남도 창원시 의창구 북면 천주로 1167,35.35464845,128.6094168,"마금산온천은 약알칼리성 수질로 평균 수온이 55℃ 이상을 유지하고 있으며, 나트륨, 철, 칼슘, 라듐 등 20여종의 광물질을 포함하고 있다. 운동욕장, 수영장, 노천탕 등 보양온천 시설을 갖추고 치료와 요양, 휴양이 가능하다.",QR 인증,19,APPROVED,4812100000
1,창원과학체험관,경상남도 창원시 성산구 충혼로 72번길 16,35.230268,128.6617774,미래 과학자의 소중한 꿈을 키워 나갈 수 있도록 자라나는 꿈나무들에게 과학을 쉽고 재미있게 즐기면서 배울 수 있는 과학체험관이다.,위치 인증,246,APPROVED,4812300000
1,마산해양레포츠센터,경상남도 창원시 마산합포구 제2부두로 56,35.19529973,128.5738199,배를 타고 들어와 해양체험을 즐길 수 있는 이색적인 해양레포츠센터이다. 요일별 체험 프로그램을 진행하고 있으며,위치 인증,493,APPROVED,4812500000
1,웅천도요지전시관,경상남도 창원시 진해구 두동도요로 198,35.12738997,128.8155983,웅천도요지 출토품을 비롯한 80여점의 유물이 전시되어 있는 전시실과 도자기를 직접 만들어 볼 수 있는 체험공방을 운영하고 있다.,위치 인증,472,APPROVED,4812900000
1,속초해수욕장,강원특별자치도 속초시 해오름로 186,38.19014884,128.6035305,"해안선 길이 약2km, 백사장 길이 약 500m이며 수심이 얕아 가족단위 관광객이 선호하는 속초시 대표 관광지이다.",사진 인증,386,APPROVED,5121000000
1,척산온천,강원특별자치도 속초시 관광로 327,38.19020313,128.5407019,"1971년 설립된 온천장으로 지하 4,000km 심도에서 발생한 온천수를 이용하며 설악산과 근접한 위치에 자리잡고 있다.",위치 인증,373,APPROVED,5121000000
1,설악한화리조트,강원특별자치도 속초시 미시령로 2983번길 111,38.21030036,128.5287214,"천연 온천수를 이용한 온천시설과 물놀이 시설을 갖춘 종합 테마파크이며, 설악 워터피아 등 다양한 부대시설은 완비하고 있다.",위치 인증,324,APPROVED,5121000000
1,은평역사한옥박물관,서울특별시 은평구 연서로50길 8,37.64033246,126.9380102,은평구의 문화유산과 한옥의 전통을 소개하는 박물관,위치 인증,240,APPROVED,1138000000
1,금성당,서울특별시 은평구 진관2로 57-23,37.63513547,126.92538,세종대왕 6째 아들 금성대군을 모신 당,위치 인증,29,APPROVED,1138000000
1,우장춘기념관,부산광역시 동래구 우장춘로62번길 7(온천동),35.213515,129.0720181,씨 없는 수박으로 우리 모두에게 잘 알려진 세계적 육종학자인 故우장춘박사의 탄생 1백주년을 맞아 그의 생전 연구 활동 유적지,위치 인증,383,APPROVED,2626000000
1,장영실과학동산,부산광역시 동래구 동래역사관길 18(복천동),35.20916308,129.0896688,"동래출신 조선시대 세종당시 최고의 과학자인 장영실이 만든 세계최고의 옛 천문의기 18종 19점을 동래읍성북문광장 1,177㎡에 시비 5억을 투입하여 2009. 6. 16.부터 2009.10.15.까지 4개월에 걸쳐 사업을 완료하였다.",위치 인증,189,APPROVED,2626000000
1,박차정의사생가,부산광역시 동래구 명륜로 98번길 129-10(칠산동),35.20169645,129.090397,"박차정의사 생가 복원사업은 항일독립운동가이자 한국여성해방운동의 선구자인 박차정의사의 남편 김원봉(임시정부국무위원, 북한노동상, 국가검열상)의 사회주의적 성향으로 군사정부시절 대우를 받지 못하다가 1995년 광복 40주년에 문민정부로부터 “대한민국 건국훈장 독립장”을 추서받은 지 10년만인 2005년 7월 8일 완공하였다.",QR 인증,403,APPROVED,2626000000
1,금강공원,부산광역시 동래구 우장춘로 155 (온천동),35.21962513,129.075758,"울창한 숲과 기암절벽, 골짜기 마다 흐르는 맑은 시냇물 등이 신선경에 들어선 느낌을 주며, 봄철부터 겨울철에 이르기까지 인적이 끊이지 않는 근린공원으로서 남녀노소 누구나가 즐길 수 있는 휴식처로 사랑을 받고 있다",사진 인증,240,APPROVED,2626000000
1,장계관광지,충청북도 옥천군 안내면 장계1길 57,36.37753534,127.6350074,"아름다운 대청호반이 한눈에 내려다보이며, 향토자료 및 시문학 작품을 감상할 수 있음",위치 인증,17,APPROVED,4373000000
1,금정산,부산광역시 금정구 범어사로 250,35.28304264,129.0676208,금정산은‘산마루에 우물이 있어 한 마리 금빛 나는 물고기가 오색구름을 타고 하늘에서 내려 와 우물 속에 놀았다’는 이야기에서 유래하여 이름 붙은 부산의 진산이다.,QR 인증,388,APPROVED,2641000000
1,범어사,부산광역시 금정구 범어사로 250,35.28304308,129.0676212,범어사는 역사적으로 많은 고승대덕을 길러내고 선승을 배출한 수행사찰로 오랜 전통과 많은 문화재가 보존되어 있는 한국 불교계의 중심지 중 하나이다.,위치 인증,202,APPROVED,2641000000
1,곡성 섬진강 기차마을,전라남도 곡성군 오곡면 기차마을로 232,35.27753157,127.3082867,"증기소리가 둔탁하지만 촌스럽지 않고, 많은 사람들의 관심을 받지만 혼자만의 공간이 있는곳.증기기관차와 레일바이크체험, 음악분수, 엔터테인먼트 놀이공간까지 옛 추억과 테마가 있는 새로움과 익숙함이 공존하는 새로운 개념의 테마파크이다.인기 관광지로 각광을 받고 있는 기차마을의 첫 관문은 옛 곡성역 건물을 그대로 기차마을 정문으로 사용하고 있다. 그래서 그곳을 통과하면 아련한 추억이 기다리고 있을 것 같다.1960년대를 고스란히 옮겨 놓은 것 같은 플랫폼으로 기차가 들어오자 내리는 승객들과 그것을 배경으로 사진을 찍어 추억을 남기고 , 플랫폼에는 수형이 아름다운 두 그루의 소나무가 있는데 소나무를 배경으로 나란히 서서 단체사진을 찍어도 멋지다.관람은 반 시계 방향으로 돌면서 관람시설과 놀이시설을 하나씩 섭렵해가는 것이 가장 효과적인데 기차 체험 공간 치치뿌뿌 놀이터, 오감으로 느끼는 4D 영상관, 커다란 도깨비가 방망이를 치켜들고 서 있는 재미있는 요술 랜드를 차례로 돌아보는 동안 우리는 어느덧 동심의 세계에 흠뻑 빠져들수 있다. 전통체험관에서 칼에 글귀를 새기는 무형문화재 낙죽장도 전시관도 볼 수 있다.기차마을 최고의 포토존으로 알려진 장미공원은 기차마을 안에 있으면서도 별도의 공원이나 다름없는 매우 특별한 공간이다. 장미공원은 무려 3만 7천여주, 1004종의 장미와 세계 몇 안 되는 희귀종도 수십종을 보유중이다.그리고 그 명성을 유지하기 위해 숙련된 원예 전문가들이 일년 내내 정성을 다하여 관리하고 있는데 5월 장미 축제때는 이곳의 장미들이 일제히 개화를 하면서 대단한 장관이 펼쳐진다.이때 우리나라 최고로 꼽히는 장미의 향연을 즐기기 위해서 전국에서엄청난 관광객들이 몰려드는데 곡성 장미공원의 5월 장미는 꼭 봐야할 명소이다.",QR 인증,422,APPROVED,4672000000
1,기차마을 장미공원,전라남도 곡성군 오곡면 기차마을로 232,35.27753157,127.3082867,"섬진강기차마을 단지 내에 위치한 장미공원은 대한민국 최고의 장미공원을 목표로 사랑의 상징 ‘천사’와 음이 같은 1,004 품종을 수집하여 40,000㎡의 부지에 독일, 프랑스, 영국 등 유럽의 우수한 장미품종들을 수집, 전국에서 가장 많은 1,004종의 장미를 식재하여 조성되었다. 장미와 다양한 수목, 연못 등이 아름다운 경관을 이루고 있으며, 그 밖에 분수, 미로원, 야외공연장, 파고라 등 다양한 시설을 갖추고 있다. 독특하고 다양한 장미품종들을 정성스럽게 관리하여 5~11월 계속해서 장미꽃을 감상할 수 있고, 매년 5월에서 6월 사이 세계장미축제를 개최하여 많은 관광객들을 맞이하고 있다.",QR 인증,496,APPROVED,4672000000
1,섬진강 침실습지,전라남도 곡성군 고달면 고달길 192-6,35.27503038,127.3335915,"제22호 국가기정습지로서 천혜의 자연환경이 잘 보전되어 있다. 수달, 흰꼬리수리, 삵 등 멸종위기 동물의 서식지이다. 이른 아침 물안개와 일출, 그리고 일몰풍경 등 시시각각 변하는 풍경이 한 폭의 동양화를 연상시킨다.침실 습지는 섬진강 유역인 곡성군 고달면 고달교에서 오곡면 오지1교까지 서울 여의도 면적과 비슷한 규모의 광활한 강 습지로서 물버들 군락이 이룬 가운데, 강변에는 울창한 갈대숲이 형성되어 있다.수달, 고라니, 오소리를 비롯한 포유류와 다양한 조류들이 서식 하는 생태계의 보고로 2016.11.7 국가습지보호구역으로 지정되었다.침실 습지는 언제 어느 때 찾아도 섬진강이 자아내는 아름다움의 진수를 만날 수 있지만 특히 이른 아침 무렵에 찾아가면 겨울에는 상고대, 이른 봄과 가을에는 물안개가 그려내는 비경을 만날 수 있다.버드나무와 갈대숲 그리고 크고 작은 섬들이 어우러져 아름다운 경관을 자랑한다.빼어난 풍경과 생물 다양성을 인정받아 2016년 11월에 강 중류 하도습지로는 유일하게 환경부로부터 22번째 국가습지로 지정되었다. 특히 일교차가 심한 새벽이면 물안개가 피어오르면서 환상적인 장면을 연출한다.",사진 인증,423,APPROVED,4672000000
1,곡성아트빌리지,전라남도 곡성군 오곡면 섬진강로 1455,35.23004949,127.3677915,"곡성아트빌리지는 섬진강 증기기관차가 운행하는 가정역에 위치해 있으며 아트갤러리, 유리공예 체험장, 야외공연장, 캡슐호텔과 목조펜션, 카페굴리엘모 등으로 이루어져 있어 가정역에서 머무르며 향기 가득한 차 한잔과 함께 낭만 가득한 섬진강을 느껴볼 수 있다.",위치 인증,284,APPROVED,4672000000
1,합천박물관,경상남도 합천군 쌍책면 황강옥전로 1558,35.58042271,128.2829423,합천의 살아숨쉬는 역사와 문화가 담긴 관광지,위치 인증,145,APPROVED,4889000000
1,황매산군립공원,경상남도 합천군 가회면 황매산공원길 4,35.48184913,128.0037495,사계절 색이 바뀌는 도화지로 풍경이 일품인 대표관광지,QR 인증,183,APPROVED,4889000000
1,영상테마파크&청와대세트장,경상남도 합천군 용주면 합천호수로 757,35.54877253,128.0728984,"국내 최대 영화, 드라마세트장으로 많은 프로그램이 촬영된 장소",위치 인증,12,APPROVED,4889000000
1,황계폭포,경상남도 합천군 용주면 황계2길 30,35.51135706,128.071173,떨어지는 폭포소리와 그 풍경이 예술인 자연의 신비,사진 인증,481,APPROVED,4889000000
1,정양레포츠공원,경상남도 합천군 대양면 동부로 39-13,35.55690191,128.1668052,남녀노소 즐길거리가 다양한 여름 대표 휴가지,위치 인증,11,APPROVED,4889000000
1,정양늪생태공원,경상남도 합천군 대양면 대야로 730,35.55322772,128.162786,자연을 직접 느끼고 경험할 수 있는 생태관광지,위치 인증,199,APPROVED,4889000000
1,해인사 소리길,경상남도 합천군 가야면 가야산로 1160,35.76749785,128.1365362,"트래킹코스로 사랑받고, 다양한 꽃길을 보유한 소리길",위치 인증,239,APPROVED,4889000000
1,신소양체육공원,경상남도 합천군 합천읍 영창리 898,35.580901,128.170251,"핑크뮬리, 유채, 황화고스모스 등 계절별 초화류 및 은행나무 군락지",QR 인증,355,APPROVED,4889000000
1,삽교호관광지,충청남도 당진시 신평면 삽교천3길 100,36.88890544,126.8247541,"서해대교를 비롯, 호수와 바다가 한눈에 들어오는 곳",QR 인증,242,APPROVED,4427000000
1,왜목마을관광지,충청남도 당진시 석문면 왜목길 15-5,37.04493276,126.5246154,"서해 최고의 일출, 일몰 감상지",QR 인증,199,APPROVED,4427000000
1,김포평화누리길 1코스,경기도 김포시 대곶면 대명리 561(대명항),37.6535376,126.5533799,"김포 평화누리길은 대명항에서 시작하여 문수산, 애기봉 입구를 지나 전류리포구까지 3코스(총39km)로 나뉘어 조성되어 있다.",위치 인증,387,APPROVED,4100000000
1,김포평화누리길 2코스,경기도 김포시 월곶면 성동리 산49(문수산성),37.73869766,126.5484911,"김포 평화누리길은 대명항에서 시작하여 문수산, 애기봉 입구를 지나 전류리포구까지 3코스(총39km)로 나뉘어 조성되어 있다.",사진 인증,155,APPROVED,4100000000
1,김포평화누리길 3코스,경기도 김포시 하성면 전류리 43-4(전류리 포구),37.70077831,126.6622045,"김포 평화누리길은 대명항에서 시작하여 문수산, 애기봉 입구를 지나 전류리포구까지 3코스(총39km)로 나뉘어 조성되어 있다.",사진 인증,385,APPROVED,4100000000
