user_id,title,address_detail,lat,lng,content,proof_method,view_count,status,emd_cd
1,아산조방원미술관,전라남도 곡성군 옥과면 미술관로 288,35.29706668,127.1224042,"아산 조방원 화백(雅山 趙邦元 畵伯, 1922년 전남 무안출생)이 자신의 노후 작품 활동을 정리하고 제자들을 육성할 수 있는 공간을 마련키 위해 평생 모아온 미술품 6천 7백여점과 부지 4천 2백여평을 전라남도에 기증함으로써 지난 88년부터 공사가 시작되어 96년 완공된 전라남도 옥과 미술관은 옥과면 옥과리에 소재하여 4천 2백여평의 부지에 2층으로 3백여평 규모의 전시관을 구비한 현대식 미술관이다. 아산 조방원 미술관을 가족과 함께 찾아 가려면 옥과면 소재지에서 죽림천을 따라 포장도로 10여분 차를 타고 가다 보면 지동마을이 나오고 다시 왼편으로 조금 더 가다 보면 검정 기와 지붕에 빨간 벽돌로 지어진 옥과미술관과 숲속에 은근히 성륜사가 나타난다. 아산 조방원 미술관 1층 전시실에는 남도 중진 및 중견작가 작품 등, 동·서양화 40여점이 전시되어 있으며 2층에는 아산 조방원 선생이 기증한 소치 허련 선생의 사군자, 모란, 추사 김정희 선생의 서간문, 퇴계 이황 선생의 詩 그리고 아산 조방원 선생의 작품 歸路 , 田家 등이 전시되어 가족 방문객과 미술 관람객들의 발길이 계속되고 있으며 전남 미술의 진수를 한눈에 느낄 수 있고 전남 예술인들의 창작 의욕을 불러 일으키는 전당이 되고 있다.",QR 인증,438,APPROVED,4672000000
1,곡성생태체험관,전라남도 곡성군 옥과면 월파로 295,35.31719414,127.1699834,"맑고 푸른 섬진강변의 수려한 자연경관을 배경으로 한 현장 체험 위주의 전인 교육장으로 환경과 자연생태의 중요성을 직접 체험하게 하여 그 소중함을 일깨우고 나아가 자연 환경보존을 실천하도록 하는데 목적이 있다.오랜 동안의 연구와 경험을 바탕으로 한 프로그램 운영으로 우리의 소중한 아이들이 즐겁게 뛰놀며 체험할 수 있고, 어른들의 지난 시절을 아름답게 추억할 수 있는 공간이다. 또한 초가집에서 잠을 자고 뛰어 놀 수 있는 놀이 마당과 창포머리감기, 고구마 구워먹기, 캠프파이어 등 방학기간 중 운영되는 환경캠프에도 많은 체험자가 참여하는 등 인기가 대단하다. 수려한 풍광을 자랑하는 곡성 옥과 설산자락, 폐교된 옛 옥수초등학교 부지에 자리 잡은 곡성생태체험관은 징검다리, 야생화 화단이 갖춰져 있어 청정 그대로의 자연과 접할 수 있다. 그리고 맘껏 뛰어놀 수 있는 널찍한 잔디 운동장과 야외무대도 마음을 사로잡는다.아련한 추억을 떠올리게 하는 옛날 초등학교 교실들은 각각 그릇을 직접 구어서 빚어볼 수 있는 도예체험관, 야생초나 야생화를 이용하여 옷감에 물을 들이는 천연염색체험관, 볏짚으로 각종 공예품을 만들어보는 짚풀 공예관 등으로 구성되어 있다. 그래서 어린이뿐만 아니라 어른들에게도 타임머신을 타고 동심의 세계로 돌아가게 해주는 곳이 곡성생태체험관이다. 가족단위 프로그램 참가신청도 가능하다.특히 방학기간에는 환경캠프를 운영 하는데, 생태체험관 기본 프로그램외에도 창포머리감기나, 고구마 구워먹기, 캠프파이어 등을 즐기며 자연과 보다 진한 교감을 맛보고 귀중한 추억도 만들 수 있다. 아울러, 함께 있는 합강투어텔에서는 숙박과 식사를 동시에 해결할 수 있어 매우 편리하다.",사진 인증,412,APPROVED,4672000000
1,심청효문화센터,전라남도 곡성군 오산면 오산로 254-4,35.20836622,127.1288481,"곡성에서는 심청의 본고장이라는 자부심으로 만행의 근본이라 일컬어지는 효(孝) 정신을 널리 전파하기 위해서 매년 심청축제를 여는 등 다양한 노력을 기울이고 있다. ’효’는 이제 곡성을 상징하는 대표 키워드나 다름없다.따라서, 곡성에는 심청이 들어가는 명칭이 많은데, 그중 하나가 심청효문화센터다. 심청효문화센터는 곡성스러운 청정하고 조용한 분위기가 물씬 풍기는 시골마을 한켠에 자리 잡고 있다. 곡성 심청의 근원지인 관음사와 연계하여 심청의 효문화를 새롭게 조명하고 현대적인 효의 위상과 의미를 재정립하여 그 중요성을 인식하게 할 수 있는 교육의 장으로 활용하고자 체험공간과 숙소동을 갖추고 운영하고 있다. 한꺼번에 100여명을 수용할 수 있는 숙박시설과, 세미나실과 잔디 운동장, 야외취사장, 음향설비 등을 갖추고 있어 학생들의 현장학습, 기업연수, 대학생 M/T장소로 활용되고 있다. 아울러 심청의 효 문화를 알리기 위한 전시실과 더불어 ’효’ 체험 프로그램을 운영하고 있어, 가족단위의 발걸음도 꾸준히 이어진다.또한 인근에 조성된 심청공원도 꼭 들러볼 만한 곳이다. 이곳엔 심청전의 배역 인물을 묘사하는 장승 23기가 세워져 있다.",위치 인증,0,APPROVED,4672000000
1,심청골짝나라학교,전라남도 곡성군 석곡면 방주마천목길 107,35.17183675,127.2580116,"전라남도교육청 대안학교 위탁교육기관인 심청골짝나라학교는 학교 부적응 학생이나 폭력 등의 문제를 일으킨 아이들에게 퇴학이나 전학 조치가 취해지던 예전과는 달리 아이들은 위탁 교육기관에서 일정 기간의 교육을 받은 후 원적학교로 복귀하게 됩니다.  심청골짝나라학교는 이러한 아이들을 무료 대안교육 하는 기관입니다. 비영리단체로 운영되며 학교 운영에 필요한 비용은 체험학습이나 수련활동, 수익사업,  교직원 연수 등 프로그램을 제공한 수익금으로 충당합니다.  이곳의 교사들 역시 변화하는 아이들을 지켜보는 기쁨만으로 7년째 봉사하고 있습니다. 진정한 ’대안교육’을 꿈꾸는 사람들이 모인 학교입니다. 현재 다양한 교육프로그램을 제공하고 있습니다.",QR 인증,162,APPROVED,4672000000
1,심청한옥마을,전라남도 곡성군 오곡면 심청로 178,35.23063008,127.3575205,"곡성군은 심청전의 원류 관음사연기설화가 있는 심청의 고장이다.KBS 역사스페셜 [역사추적 심청의 바닷길] 을 통해서 소개된 바와 같이 관음사 연기설화는 1700년전 장님 아버지를 둔 곡성의 효녀가 중국으로 건너가 진나라 황제의 황후가 되었는데, 아버지를 그리워하며 관음상을 만들어 고국으로 보내고, 아버지는 딸과 헤어지는 것이 슬퍼 흘린 눈물때문에 눈이 밝아졌다고 하는 내용이다.추론하여, 서기 300년 곡성땅은 철의 주산지였으며, 고대국가 형성의 중요한 자원이였던 철을 확보하기 위해 섬진강을 따라 중국 상인과 무역선이 드나드는 과정에서 곡성의 효녀가 중국 양자강 어귀의 보타섬으로 건너가 귀인이 되었다는 내용이다. 이에 따라 곡성군이 심청의 고장으로 떠오르면서 곡성군은 심청이 실천했던 아름다운 우리의 전통문화 효 사상을 계승 발전시키고자 전통한옥으로 된 심청이야기 마을을 조성하게 되었다.즉 효녀 심청의 이야기가 있는 마을을 만든 것이다. 심청이야기마을은 기와집과 초가집이 들어서 있는 전통 마을이다. 그래서 이곳에는 실제로 심청이살고 있을 것 같은 느낌을 준다. 마을의 이름을 ‘심청이야기마을’이라 정한 이유도 그것이다. 심청이야기마을은 섬진강을 끼고 달리는 17번 국도에서 들어간다. 돌로만들어진 이정표를 보고 증기기관차가 다니는 철길을 건너 산으로 향하는 길을 쭉 따라가면, 심청전을 상징하는 조형물들과 더불어 심청이야기마을이 모습을 드러낸다. 심청이야기마을은 억지로 산을 깍아서 조성한 것이 아니라, 원래 있었던 송정마을의 집터와 가옥의 원형을 최대한 살렸기 때문에, 전혀 이질감이 느껴지지 않는다. 이곳을 다녀간 사람들은 이구동성으로 곤방산 자락 울창한 숲속으로 연결되는 산책로를 최고로 친다. 그 길을 따라가면 곤방산 정상까지도 1시간 이내면 올라갈 수 있고, 여름밤엔 청정지역에서만 서식하는 반디불이도 어렵지 않게 만날 수 있다. 굳이 숙박을 하지않더라도 누구든지 부담없이 찾아와 마을을 둘러보며 초가집 돌담길을 배경으로 멋진 인증샷을 찍거나 곤방산 숲길을 산책할 수 ",QR 인증,232,APPROVED,4672000000
1,곡성청소년야영장,전라남도 곡성군 고달면 가정마을길 51,35.22777786,127.369723,"증기기관차 종착역인 가정역에 도착하면, 승객들은 으레 섬진강을 가로지르는 출렁다리를 건너가는데 그곳 섬진강변에 청소년 야영장이 자리 잡고 있다.청소년 야영장 설립 목적은 청소년들이 몸과 마음을 단련하고 호연지기를 기를 수 있도록 하는 종합 수련장 역할을 하는 것으로 수익성 보다는 공익을 우선으로 하는 리조트 시설이다.따라서 숙소와 식당, 강당 그리고 각종 체험 시설을 갖추고, 1박 2일 또는 2박 3일의 청소년 수련 프로그램 위주로 운영 된다. 그러나 가족을 비롯한 일반인에게도 야영장 시설을 제공한다. 우선 텐트 50동을 설치할 수 있는 야영장을 비롯하여 별도의 글램핑장이 마련되어 있고, 신청을 하면 가족단위 숙소도 이용할 수 있다. 뿐만 아니라 섬진강 레프팅, 섬진강 자전거 하이킹등 다양한 레져 활동도 지원한다. 참고로 청소년 야영장 옆에는 주야간에 천체를 관측할 수 있는 섬진강천문대를 운영하고 있다.",사진 인증,89,APPROVED,4672000000
1,곡성기차마을전통시장,전라남도 곡성군 곡성읍 곡성로 856,35.27976851,127.2984461,"곡성기차마을전통시장은 곡성의 대표적인 전통시장으로 2009년 현재의 자리로 옮긴 곡성장이 곡성기차마을전통시장으로 거듭나면서 곡성사람들은 물론 곡성 기차마을을 찾는 관광객들이 들려가는 필수 코스로 자리 잡고 있다. 애초에는 3일에 끝나는 날짜에 여는 10일 장이었다가, 19세기 중반부터 지금까지 매3일과 8일에 장이 서는 오일장으로 바뀌었다고 한다.고려말 이곳에 곡성읍이 들어설때부터 곡성장이 열렸을 것으로 추정하는데 지금까지 무려 600년을 이어온 대단한 전통을 가진 장인 셈이다. 600년 전통으로 이어 내려온 곡성장의 정취와 인심은 곡성기차마을전통시장에 고스란히 남아 있다. 지금도 곡성장에 가면 깊은 산중에서 나는 능이버섯, 송이버섯, 귀한 산나물과 약초를 쉽게 발견할 수 있다. 곡성의 특산물인 멜론, 토란같은 품질 좋은 농산물을 저렴한 가격으로 구입할 수 있다.",QR 인증,126,APPROVED,4672000000
1,곡성기차마을 패러글라이딩체험,전라남도 곡성군 오곡면 덕산리 123-6,35.26672854,127.3087391,섬진강 기찻길따라 떠나는 하늘여행 내안의 버킷리스트를 오늘 완성하세요세계대회를 개최할 수 있는 규모의 전국 최대의 패러글라이딩 체험장입니다.남녀노소 누구나 스릴 넘치는 긴장과 재미로 평생 이야기 할 수 있는 재미만 가져가세요~고객님께서 원하시는 체험을 선택 하시기만 하면 아주 멋지고 스릴넘치는 내안의 버킷리스트와 함께 소중한 추억을 담아 드리겠습니다.,QR 인증,346,APPROVED,4672000000
1,섬진강 레일바이크,전라남도 곡성군 오곡면 섬진강로 1465 (가정역),35.23015492,127.3682034,아름다운 섬진강을 품고 내려가는 색다른 경험을 온 가족이 함께 즐길수 있는 섬진강레일바이크는 구 전라선 철도를 이용하여 섬진강변을 따라 운행하고 있다. 2인승과 4인승이 있으며 섬진강과 국도 17호선을 따라 운행하며 아름다운 청정자연을 만끽할 수 있다.,사진 인증,231,APPROVED,4672000000
1,문동휴양지,경상남도 거제시 문동동 산 8,34.85648266,128.6628354,문동폭포와 함께 우그러진 숲，시원한 바람을 느낄 수 있는 도심 속 휴양지이다,위치 인증,302,APPROVED,4831000000
1,바람의언덕,경상남도 거제시 남부면 갈곶리 산14-47,34.74401583,128.6632699,영화의 제목처럼 불리는 언덕으로 실제 많은 드라마 속 배경으로 유명해졌다. 마무 계단으로 연결된 산책로를 따라 언덕을 오르면 몸을 가누기 힘들 정도의 바람이 마치 힘겨루기 하듯 불어온다. 정상 부근 벤치에 앉으면 지중해의 경치가 부럽지 않은 우리 국토의 또 다른 아름다움이 눈앞으로 펼쳐진다.,위치 인증,376,APPROVED,4831000000
1,우제봉전망대,경상남도 거제시 남부면 갈곶리 산2-16,34.73218035,128.6738928,한려해상국립공원을 한눈에 볼 수 있는 전망대로 해발 107m에 위치해 있다. 정면으로는 거제 해금강이 보여 멋진비경을 자랑한다,위치 인증,297,APPROVED,4831000000
1,청마기념관,경상남도 거제시 둔덕면 방하2길 6,34.854887,128.517123,청마 유치환이 태어난 곳으로 그이 문학 정신을 기리고 그 업적을 고양하기 위하여 기념관을 건립,위치 인증,432,APPROVED,4831000000
1,씨월드,경상남도 거제시 일운면 지세포해안로 15,34.835848,128.701478,대한민국 최대의 돌고래 체험시설로 돌고래 만지기，악수하기，돌고래에게 먹이주기 등 다양한 체험 및 교육프로그래을 즐길 수 있다.,위치 인증,309,APPROVED,4831000000
1,알로에테마파크,경상남도 거제시 거제면 거제남서로 3937,34.835716,128.560282,알로에를 화분에 심어가져가거나 족욕을 즐기는 등 다양한 체험을 할 수 있는 테마파크,사진 인증,38,APPROVED,4831000000
1,노을이물드는언덕,경상남도 거제시 사등면 창호리 1475,34.95450963,128.5194543,푸른 빛 바다와 붉은 노을이 어우러져 아름다운 풍경을 자아내는 곳,QR 인증,46,APPROVED,4831000000
1,가조수협효시공원,경상남도 거제시 사등면 가조서로 7,34.929516,128.525144,우리나라 수산업협동조합의 처음 시작된 역사적 의미 기념하여 조성함.,사진 인증,314,APPROVED,4831000000
1,담양호국민관광지,전라남도 담양군 용면 월계리 149-67,35.4019831,126.9990829,"담양호 국민관광지는 영산강 시원지인 가마골생태공원(용소)과 청정하고 맑은 담양호, 산세가 좋은 추월산, 역사의 흔적이 깊이 남아있는 금성산성에 이르기까지 힐링과 역사의 숨결이 살아있는 천혜의 관광지임",QR 인증,12,APPROVED,4671000000
1,부석사관광지,경상북도 영주시 부석면 부석사로 298,36.99435088,128.6797054,소백산 자연환경을 배경으로 한 천년고찰 부석사를 직접 참여하고 머무르는 다양한 체험 및 관광활동 제공,QR 인증,7,APPROVED,4721000000
1,요트올림픽동산지구,부산광역시 해운대구 APEC로 30,35.16578256,129.1350266,360여척의 요트를 계류할  수 있는 요트경기장이 있는 곳으로 요트와 보트 등이 파란 바다와 마린시티의 마천루를 배경으로 어우러져 이국적인 풍경을 자아내는 곳이다. 각종 국제대회는 물론 해양스포츠와 국제영화제를 비롯한 다양한 문화행사가 개최된다,QR 인증,333,APPROVED,2635000000
1,동백섬,부산광역시 해운대구 동백로 116,35.15234205,129.1513619,해운대해수욕장 남쪽 끝에 위치한 동백섬은 율지와 연계된 육계도로 동백섬의 자연 그대롱를 공원으로 조성한 곳으로 2005년 APEC 정상회의 장소인 누리마루 APEC하우스가 자리해 있다.,사진 인증,470,APPROVED,2635000000
1,웅포관광지,전북특별자치도 익산시 웅포면 강변로 25,36.06581391,126.8754193,웅포 곰개나루 및 캠핑장,사진 인증,310,APPROVED,5214000000
1,당항포관광지,경상남도 고성군 회화면 당항만로 1116,35.05322615,128.3920276,당항포관광지는 임진왜란 당시 충무공 이순신 장군의 대첩지로서 다목적 관광지,QR 인증,243,APPROVED,4882000000
1,탄금공원,충청북도 충주시 남한강로 24,36.98782919,127.9055691,우륵이 가야금을 연주하던 장소인 탄금대 및 아름다운 남한강 변과 인접하여 충주의 관광거점 기능을 담당하는 관광지 조성,위치 인증,271,APPROVED,4313000000
1,충주호체험,충청북도 충주시 중앙탑면 중앙탑길 150,37.02308256,127.8619229,역사 문화와 수변공간이 어우러지는 체험관광지 조성 / 수변의 위락시설과 생태환경의 조화로 체험가능한 수변 휴식 학습공간 조성 /수상레저활성화를 위한 국제수변레포츠단지 조성,QR 인증,473,APPROVED,4313000000
1,능암온천,충청북도 충주시 앙성면 새바지길 37,37.09370046,127.802172,중원 유적과 충주호반 관광 등 주변 관광자원과 중부권 유일의 탄산온천 자원을 연계한 종합 온천휴양 관광지 조성,사진 인증,1,APPROVED,4313000000
1,충온온천,충청북도 충주시 앙성면 산전장수1길 103,37.10173095,127.7962316,중원 유적과 충주호반 관광 등 주변 관광자원과 중부권 유일의 탄산온천 자원을 연계한 종합 온천휴양 관광지 조성,QR 인증,194,APPROVED,4313000000
1,몰운대,부산광역시 사하구 몰운대1길 14(다대동),35.04638172,128.9680068,"태종대, 해운대와 함께 부산의 3臺 중 하나",QR 인증,336,APPROVED,2638000000
1,다대포 꿈의 낙조분수,부산광역시 사하구 몰운대1길 14(다대동),35.04638172,128.9680068,세계 최대이자 최고의 바닥 음악분수,QR 인증,487,APPROVED,2638000000
1,다대포해수욕장,부산광역시 사하구 몰운대1길 14(다대동),35.04638172,128.9680068,"백사장 길이 900m, 폭 100m의 얕은 수심으로 가족단위 피서지로 유명",QR 인증,434,APPROVED,2638000000
1,낙동강하구아미산전망대,부산광역시 사하구 다대낙조2길 77(다대동),35.05276243,128.9607468,"모래섬, 철새, 낙조 등 천혜의 전경을 조망할 수 있는 전망대",사진 인증,432,APPROVED,2638000000
1,을숙도 생태공원,부산광역시 사하구 낙동남로1233번길 25(하단동),35.11008837,128.9449571,을숙도 상단부로 수생식물이 서식하는 생태의 보고,위치 인증,296,APPROVED,2638000000
1,을숙도 철새공원,부산광역시 사하구 낙동남로 1240(하단동),35.10449092,128.9459791,철새를 보호하는 한편 습지를 비롯한 생태보존 공원,QR 인증,430,APPROVED,2638000000
1,감천문화마을,부산광역시 사하구 감내2로 203(감천동),35.09748815,129.0106077,한국전쟁 당시 피난민들이 모여산 계단식 마을로 다양한 예술작품 감상 가능,QR 인증,311,APPROVED,2638000000
1,장림포구,부산광역시 사하구 장림로 93번길 72(장림동),35.07915955,128.9513486,"배가 드나드는 강의 어귀로 조선시대 군사요충지였으며, 부네치아라 불림",사진 인증,84,APPROVED,2638000000
1,쌍암공원,광주광역시 광산구 첨단중앙로182번길 39,35.22222807,126.8442514,"한가운데 위치하고 있는 호수, 호수주변을 따라 잘 조성된 철쭉꽃 숲들과 소나무숲이 운치를 더한다.",사진 인증,18,APPROVED,2920000000
1,수완호수공원,광주광역시 광산구 장신로82번길 57,35.18794733,126.8202489,밤낮으로 호수공원의 다른 정취를 느낄 수 있으며 롯데마트를 비롯한 대형마트와 상업시설이 있어 편하게 주차 및 쇼핑을 이용할 수 있다.,QR 인증,426,APPROVED,2920000000
1,송정작은미술관,광주광역시 광산구 송정로30번길 25,35.13510527,126.7933629,"광주송정역세권 도시재생사업으로 개관한 미술관으로써, 광산 송정역세권의 입지적 특성을 고려하여 송정역 이용객들이 1913시장, 골목상권으로 유입될 수 있도록 볼 거리 제공하고 지역의 인문 문화와 어우러지고 시민이 함께하는 열린 공간으로 운영",위치 인증,112,APPROVED,2920000000
1,소촌아트팩토리,광주광역시 광산구 소촌로85번길 14-9,35.15262857,126.7912355,"광주 최초의 산업단지 문화재생시설인 소촌아트팩토리는 낡고 오래된 민방위비상대피시설(방공호)과 아시아문화중심도시 홍보관(아시아문화마루)으로 사용되었던 폐컨테이너를 조합해 리뉴얼한 복합문화공간이다.2015년 개관하였으며 큐브미술관, 아르코공연연습센터, 유노윤호 작은도서관 HUG및 부대시설 등을 갖추고 있다. 오랫동안 쓸모없이 방치되었던 유휴공간이 문화예술 콘텐츠 융합을 통해 시민들의 일상을 풍요롭게 하는 혁신공간으로 재탄생한 것이다.",QR 인증,99,APPROVED,2920000000
1,별밤미술관 in 첨단,광주광역시 광산구 첨단중앙로182번길 39,35.22222807,126.8442514,"코로나19 팬데믹으로 위축된 예술인들의 활동을 장려하고 대중 속에서 꽃피는 전시문화를 위해, 주민들이 즐겨 찾는 거점공간에 비대면 간이 미술관 5개소를 조성 및 운영하고있습니다.  별밤미술관은 탁 트인 야외 공원에 위치하고 있고 저녁 시간에 운영하기 때문에 직장에 다니거나 일을 하느라 바쁜 일상에서 일부러 시간을 낼 필요도 없습니다. 퇴근 후 동네 공원에서 산책하시거나 운동하시면서 좋은 작품을 여유롭게 즐기시기만 하면 됩니다.",QR 인증,275,APPROVED,2920000000
1,별밤미술관 in 수완,광주광역시 광산구 풍영정천자전거길 1030,35.18597183,126.819001,"코로나19 팬데믹으로 위축된 예술인들의 활동을 장려하고 대중 속에서 꽃피는 전시문화를 위해, 주민들이 즐겨 찾는 거점공간에 비대면 간이 미술관 5개소를 조성 및 운영하고있습니다.  별밤미술관은 탁 트인 야외 공원에 위치하고 있고 저녁 시간에 운영하기 때문에 직장에 다니거나 일을 하느라 바쁜 일상에서 일부러 시간을 낼 필요도 없습니다. 퇴근 후 동네 공원에서 산책하시거나 운동하시면서 좋은 작품을 여유롭게 즐기시기만 하면 됩니다.",위치 인증,490,APPROVED,2920000000
1,별밤미술관 in 운남,광주광역시 광산구 목련로 156,35.17144137,126.8159402,"코로나19 팬데믹으로 위축된 예술인들의 활동을 장려하고 대중 속에서 꽃피는 전시문화를 위해, 주민들이 즐겨 찾는 거점공간에 비대면 간이 미술관 5개소를 조성 및 운영하고있습니다.  별밤미술관은 탁 트인 야외 공원에 위치하고 있고 저녁 시간에 운영하기 때문에 직장에 다니거나 일을 하느라 바쁜 일상에서 일부러 시간을 낼 필요도 없습니다. 퇴근 후 동네 공원에서 산책하시거나 운동하시면서 좋은 작품을 여유롭게 즐기시기만 하면 됩니다.",QR 인증,464,APPROVED,2920000000
1,별밤미술관 in 신창,광주광역시 광산구 왕버들로 331,35.19467258,126.8452966,"코로나19 팬데믹으로 위축된 예술인들의 활동을 장려하고 대중 속에서 꽃피는 전시문화를 위해, 주민들이 즐겨 찾는 거점공간에 비대면 간이 미술관 5개소를 조성 및 운영하고있습니다.  별밤미술관은 탁 트인 야외 공원에 위치하고 있고 저녁 시간에 운영하기 때문에 직장에 다니거나 일을 하느라 바쁜 일상에서 일부러 시간을 낼 필요도 없습니다. 퇴근 후 동네 공원에서 산책하시거나 운동하시면서 좋은 작품을 여유롭게 즐기시기만 하면 됩니다.",사진 인증,403,APPROVED,2920000000
1,별밤미술관 in 선운,광주광역시 광산구 선운로2번길 40,35.14604759,126.7732908,"코로나19 팬데믹으로 위축된 예술인들의 활동을 장려하고 대중 속에서 꽃피는 전시문화를 위해, 주민들이 즐겨 찾는 거점공간에 비대면 간이 미술관 5개소를 조성 및 운영하고있습니다.  별밤미술관은 탁 트인 야외 공원에 위치하고 있고 저녁 시간에 운영하기 때문에 직장에 다니거나 일을 하느라 바쁜 일상에서 일부러 시간을 낼 필요도 없습니다. 퇴근 후 동네 공원에서 산책하시거나 운동하시면서 좋은 작품을 여유롭게 즐기시기만 하면 됩니다.",위치 인증,461,APPROVED,2920000000
